pid,label,creator,location,_date,catalog record permalink,maneuver (object_type),description
ibx17_mother_hubbard,Old Mother Hubbard: Magical Changes with Mother Goose Melodies,"Martin, Sarah Catherine and William Ludwell Sheppard (illustrator)",New York,1879,https://bobcat.library.nyu.edu/permalink/f/ci13eu/nyu_aleph001562921,Turn,"This late nineteenth-century children’s book is a later American example of the movable type of children’s book originating in mid-seventeenth century England and known as the metamorphic book, flap book, turn-up book, or harlequinade. Whereas earlier flap books comprised engraved illustrations, this one uses tinted lithographs for its illustrations (the illustrator, William Ludwell Sheppard, was a noted artist). Old Mother Hubbard is the 4th in the 6-part Mother Goose Series published by G.W. Carleton in the late 1870s. Carleton referred to its lithographs as “magic colored pictures.” PARAGRAPH Like the other books in the series, Old Mother Hubbard is full of violent verse and images that appear inconsistent with literature considered appropriate for young readers, the apparent intended audience. Verses in the book for instance refer to “John O’Gudgeon” the “wild man” who “whipt his children now and then,” making them “dance.” The effect of unexpected horror and subversion is accentuated by the book’s format, which requires readers to pick up the flap whose front makes up one image to reveal another lying underneath. The metamorphic flap page selection exhibited shows on the outer flap Old Mother Hubbard leaving the house she shares with a dog to go to the bakery. When lifting the flap, she is shown returning home to find the dog dead. With the flick of a wrist and turning of a flap page, the narrative expands, progresses and mutates visually, textually and kinetically."
ibx18_denzer_trifold,Ninety One at Sixty Ninth: Twenty Three Poems,"Denzer, Ben",New York,2020,Uncataloged,Turn,"This artist’s book by artist and designer Ben Denzer, which compiles poems by Sidney Offit (1928 - ), defamiliarizes the spatial mechanics of opening and reading a book by experimenting with paper folds and page order. Looking at first glance like a piece of ephemera from everyday life, a gatefold promotional pamphlet with a stapled binding that one might receive in the mail or pick up at a gallery or museum, this book is in fact a hand-bound paper puzzle. Through the simple maneuver of using pamphlet stitch to create a binding for folded leaves of paper along each end of the trifold cover, the book turns reading into a multi-directional experience. The codex model of reading from front to back or back to front is disrupted; Denzer’s numbering system necessitates reading pages from one end to another in order to proceed sequentially. Each page turn becomes an act of unfolding or unwrapping in order to reach the last poem, which is placed on the center panel. Closing the book necessitates an act of layering each page from opposite ends on top of the other to return the pages to their original order. Such structural quirks and witticisms make one even more aware of the actions made possible by the standard modern book format, including the random access it allows, as opposed to the sequential access (akin to a scroll) necessitated by the gatefold structure of Denzer’s book. Herein lies the paradox of this artist’s book: the playfulness of its inventive structure calls attention to the fixed conventions of the modern codex format while at the same revealing the inherent flexibility of its structure."
ibx19_denzer_cheese,,,,,,,
ibx20_mattioli,New Kreüterbuch,"Mattioli, Pietro Andrea and Georg Handsch (translator)",Prag,1563,https://bobcat.library.nyu.edu/permalink/f/ci13eu/nyu_aleph000039075,Use,"This book is a German translation of Pietro Andrea Mattioli’s Commentarii in sex libros Pedacii Dioscoridis. First published in Italian in 1544, the Commentarii was the preeminent botanical reference work during its time period; 32,000 copies of the earlier edition were sold. Mattioli (1501-1577), like all Italian botanists at the time, was a devoted student of the classical Greek text De material medica libri quinque by the physician, botanist and pharmacologist Dioscorides (c. 40-90 AD). Though its title presents him as a “commentator” on Dioscorides’s study, he made original contributions too and augmented Discorides’s 800 plant compendium by including every plant known to him. Many of these were reported to him by friends and acquaintances who traveled to distant countries, like the Flemish herbalist and diplomat to the Ottman Empire, Busbecq (1522-1592), and made botanical drawings in Turkey for Mattioli. PARAGRAPH The stunning woodcuts (made by Giorio Liberale and Wolfgang Meyerpack) appearing in this edition are original to it. Some are hand-colored, a practice of interacting with the book’s prints that might have been undertaken by the book owner or by print shop workers. A vivid indicator that this book was used arises in the pressed plant leaves that appear throughout this folio sized volume. The pressed plant suggests the reader not only spent time turning the pages of this heavy and large book, but also studied them closely. The reader also carried the information conveyed by Mattioli and those he in turn was informed by inside his mind and found specimens of the same plants within his own immediate environments. By collocating the real plant against the one described and illustrated in Mattioli’s plant book, the reader brought his world into direct contact with the one embodied by print."
ibx21_archer,A Compendious Herbal,"Archer, John",London,1673,http://bobcat.library.nyu.edu/primo-explore/fulldisplay?docid=nyu_aleph003996065&context=L&vid=NYU&search_scope=all&tab=all&lang=en_US,Use,"Like Mattioli’s New Kreüterbuch HYPERLINK, another herbal in this exhibition, Archer’s book, is a “compendious, though Brief” compilation of names for different herbs and their general characteristics and recommended usages. The leaves of alder tree, for instance, “put to the bare feet gauled with travelling,” are recommended for being “very refreshing.” According to the author, John Archer (fl. 1660-1684), King Charles II’s court physician, this book, a follow-up to his earlier Every Man his own Doctor (1671), seeks to turn readers “in short time” into “Competent Herbalist.” Its “brevity” was intended to make the book “more portable” and “more useful, as a Vade Mecum” (“go with me” in Latin) or reference book. PARAGRAPH The owner of this copy allowed it to function even more as a vade mecum by creating a meticulously organized index on several blank leaves inserted at the back of the book. The terms in the index are of such wide-ranging and general ailments as “cough,” “cramp,” “bruises,” “belly ach,” “astma,” “gout,” “fatnesse,” “baldneses,” “dissentary.” By extracting the pertinent topics from each herb entry and compiling them alphabetically with corresponding page numbers in an index, the book owner mapped out the spaces of the book in terms of his own needs and made them easy to find. In this way the creation of an index was the operative step taken to turn Archer’s book decisively from an object to be read to an object to be used and consulted frequently. Given the comprehensiveness and density of the index, it is clear the book was subject to great care, both as an object of reading and an object of use in the owner’s daily life. As a soiled and worn vade mecum, it apparently went where the owner did."
ibx22_hebrew_calendar_wheel,Sefer ‘Evronot,Eliʻezer ben Yaʻaḳov Belin Ashkenaz,ʼOfi Bakh,1722,https://bobcat.library.nyu.edu/permalink/f/ci13eu/nyu_aleph004032221,Use,"The book this volvelle appears in is known as a Sefer ‘Evronot, a Hebrew calendar book. The volvelle was one of the tools used not just for pivotal dates and worshipping times for Jews, but also for calculating such dates as Christan holidays. This knowledge was a critical aid for protecting Jews from the danger posed by their different worshipping times and habits from the dominant culture. The headings on the wheel denote the arrival of the new moon, which marks the start of the Jewish month, and the cycle of the sun. Whereas calendars appear in general to be a “convenient way to coordinate human movements with natural time,” Elisheva Carlebach points out, the Sefer ‘Evronot demonstrates that calendars have different methods for doing so that are culturally and historically based. The wheel demands interaction from the reader in order to yield the useful information that is computed with each push of the wheel by the finger."
ibx23_smith_eliza,,,,,,,
ibx24_horn_book,Horn Book,Unknown,England,1750,https://bobcat.library.nyu.edu/permalink/f/ci13eu/nyu_aleph004208062,Use,"The alphabet, as literature scholar Patricia Crain puts it, is “the first step to literacy training.” Horn books had been used for teaching the alphabet since the fifteenth century and continued to be used until the nineteenth century, with little change to its design or function. This mid eighteenth-century example example from England has roughly the same dimensions as an iPhone Mini or small smartphone. The name “horn book” derives from the transparent sheet of animal (sheep, ox or cow) horn used to protect the paper or parchment on which the letters of the alphabet, vowels and numbers are written. The structure of the “book” in this way bears more similarities with a tablet or phone window than a codex. The hook at the end of the paddle handle allowed the child to attach the hornbook to a girdle worn around the waist. Not only did this prevent the hornbook from getting misplaced, but also gave it a physically intimate status as a tool for helping the child to memorize the alphabet."
ibx25_ames_almanack,"An Astronomical Diary, or Almanack for the Year of our Lord Christ 1769","Ames, Nathaniel",Boston,1769,https://bobcat.library.nyu.edu/permalink/f/1c17uag/nyu_aleph002364398,Use,"This American eighteenth-century almanac or pocket diary represents a print genre that had first begun appearing in England in the mid-sixteenth century, and enjoyed immense popularity as cheap and ephemeral book items. They were filled with information presented in charts meant to help one plan, make decisions or take particular actions in their day-to-day activities, including mercantile ones. The centerpiece of these almanacs were the monthly calendars with information pertaining to different topics, including historical events, the weather, holidays, phases of the moon, and astrology. The back of this almanac includes a table of roads from Boston to other New England cities, indicating the extent to which this book genre was meant to be carried throughout one’s daily journeys. PARAGRAPH The pocket diary was worn on the body of its owner, carried in his pocket. In consequence, the body of the unbound volume developed wear. The cover’s paper is tattered and creased. Almanacs also bear the marks of their owners’ activities and existence in whatever blank space could be found inside them, or made to have inside them, with the help of printers adding blank sheets when requested by customers. Here, its owner writes about his location on the page opening for the months of August and September: “From my own Appartment from May 1769 to Septembr in the same year.” The appearance of handwriting on the almanac pages creates a striking image of manuscript interacting with print, and of individual selfhood finding a space for itself in a generic setting."